{
  "attempts": [
    {
      "accepted": true,
      "attempt": 1,
      "decision": {
        "arguments": {},
        "supplier_id": null,
        "type": "request_buyer_clarification"
      },
      "error": null
    },
    {
      "accepted": true,
      "attempt": 2,
      "decision": {
        "arguments": {},
        "supplier_id": null,
        "type": "identify_suppliers"
      },
      "error": null
    },
    {
      "accepted": true,
      "attempt": 3,
      "decision": {
        "arguments": {},
        "supplier_id": "syn-ups-a",
        "type": "send_rfq"
      },
      "error": null
    },
    {
      "accepted": true,
      "attempt": 4,
      "decision": {
        "arguments": {},
        "supplier_id": "syn-ups-b",
        "type": "send_rfq"
      },
      "error": null
    },
    {
      "accepted": true,
      "attempt": 5,
      "decision": {
        "arguments": {},
        "supplier_id": "syn-ups-c",
        "type": "send_rfq"
      },
      "error": null
    },
    {
      "accepted": true,
      "attempt": 6,
      "decision": {
        "arguments": {},
        "supplier_id": null,
        "type": "evaluate_quotes"
      },
      "error": null
    },
    {
      "accepted": true,
      "attempt": 7,
      "decision": {
        "arguments": {
          "reason": "Revise the quote to include the required installation equipment while retaining delivery within 60 days ARO; Supplier A withdrew and Supplier B is not eligible for the total small-business set-aside."
        },
        "supplier_id": "syn-ups-c",
        "type": "request_quote_revision"
      },
      "error": null
    },
    {
      "accepted": true,
      "attempt": 8,
      "decision": {
        "arguments": {},
        "supplier_id": "syn-ups-c",
        "type": "answer_supplier_question"
      },
      "error": null
    },
    {
      "accepted": true,
      "attempt": 9,
      "decision": {
        "arguments": {},
        "supplier_id": null,
        "type": "evaluate_quotes"
      },
      "error": null
    },
    {
      "accepted": true,
      "attempt": 10,
      "decision": {
        "arguments": {
          "awards": [
            {
              "quote_event_id": "e6",
              "scope": "package",
              "supplier_id": "syn-ups-c"
            }
          ],
          "reason": "Supplier C's revised quote meets the total small-business set-aside, includes the required installation equipment, covers all 80 batteries, and satisfies the 60-day ARO delivery requirement. Supplier A withdrew, and Supplier B is ineligible."
        },
        "supplier_id": "syn-ups-c",
        "type": "award_supplier"
      },
      "error": null
    }
  ],
  "benchmark": {
    "name": "LongProcureBench",
    "runner_version": "0.1.0"
  },
  "episode_id": "electrical-usaf-ups-019",
  "error": null,
  "evaluation": {
    "checkpoint_diagnostics": {
      "procedural": {
        "all_completed": true,
        "completed": 3,
        "results": [
          {
            "checkpoint": "solicit_competition",
            "complete": true,
            "detail": "RFQs sent to 3 suppliers",
            "evidence_mode": "direct"
          },
          {
            "checkpoint": "evaluate_quotes",
            "complete": true,
            "detail": "Quote evaluation action observed",
            "evidence_mode": "direct"
          },
          {
            "checkpoint": "award_or_recommend",
            "complete": true,
            "detail": "Terminal decision reached",
            "evidence_mode": "direct"
          }
        ],
        "total": 3
      },
      "proxy": {
        "all_completed": true,
        "completed": 3,
        "results": [
          {
            "checkpoint": "validate_eligibility",
            "complete": true,
            "detail": "Eligibility rule passed with evaluate_quotes",
            "evidence_mode": "proxy"
          },
          {
            "checkpoint": "normalize_quotes",
            "complete": true,
            "detail": "Evaluation occurred with 3 revealed quotes",
            "evidence_mode": "proxy"
          },
          {
            "checkpoint": "validate_compliance",
            "complete": true,
            "detail": "Hard constraints passed with evaluate_quotes",
            "evidence_mode": "proxy"
          }
        ],
        "total": 3
      }
    },
    "constraint_violations": [],
    "economic_objective": {
      "description": "Among remaining eligible feasible active offers, prefer the lowest total awarded price.",
      "kind": "minimize_total_price",
      "matched_outcome_id": "o1",
      "preferred_outcome_ids": [
        "o1"
      ],
      "satisfied": true
    },
    "efficiency": {
      "accepted_actions": 10
    },
    "episode_id": "electrical-usaf-ups-019",
    "episode_success": true,
    "episode_success_v02": true,
    "evaluation_version": "0.2.0",
    "feasible_obligation_success": true,
    "feasible_process_success": true,
    "hard_constraints": {
      "all_passed": true,
      "passed": 6,
      "results": [
        {
          "checks": [
            {
              "detail": "syn-ups-c eligibility_state='eligible' == 'eligible'",
              "kind": "award_supplier_equals",
              "passed": true
            }
          ],
          "constraint_id": "c1",
          "description": "Awarded supplier must satisfy the real total small-business set-aside.",
          "passed": true
        },
        {
          "checks": [
            {
              "detail": "package quantity=80 == 80",
              "kind": "award_quote_equals",
              "passed": true
            }
          ],
          "constraint_id": "c2",
          "description": "Award must cover the real quantity of 80 batteries.",
          "passed": true
        },
        {
          "checks": [
            {
              "detail": "package lead_time_days=58 <= 60",
              "kind": "award_quote_max",
              "passed": true
            }
          ],
          "constraint_id": "c3",
          "description": "Delivery must satisfy the real 60-day ARO requirement.",
          "passed": true
        },
        {
          "checks": [
            {
              "detail": "package installation_equipment=True == True",
              "kind": "award_quote_equals",
              "passed": true
            }
          ],
          "constraint_id": "c4",
          "description": "Awarded scope must include the installation equipment stated in the real requirement.",
          "passed": true
        },
        {
          "checks": [
            {
              "detail": "syn-ups-c withdrawn=False",
              "kind": "award_supplier_not_withdrawn",
              "passed": true
            }
          ],
          "constraint_id": "c5",
          "description": "A withdrawn supplier cannot receive award.",
          "passed": true
        },
        {
          "checks": [
            {
              "detail": "selected=e6, latest=e6",
              "kind": "award_quote_latest",
              "passed": true
            }
          ],
          "constraint_id": "c6",
          "description": "Only the latest revealed revision for a supplier may support award.",
          "passed": true
        }
      ],
      "total": 6
    },
    "obligations": {
      "actionable": 3,
      "all_actionable_resolved": true,
      "encountered": 3,
      "has_actionable_obligations": true,
      "no_opportunity": 0,
      "not_applicable": 0,
      "resolution_rate": 1.0,
      "resolved": 3,
      "results": [
        {
          "actionable": true,
          "applicability_reason": "matching_event_revealed",
          "applicable": true,
          "category": "event_obligation",
          "checkpoint": "recover_from_withdrawal",
          "detail": "Terminal decision restored a feasible hard-constraint-satisfying path without awarding the withdrawn supplier.",
          "obligation_id": "recover_from_withdrawal:e4",
          "resolution_step": 10,
          "resolved": true,
          "status": "resolved",
          "supplier_id": "syn-ups-a",
          "trigger_event_id": "e4",
          "trigger_step": 6
        },
        {
          "actionable": true,
          "applicability_reason": "matching_event_revealed",
          "applicable": true,
          "category": "event_obligation",
          "checkpoint": "handle_supplier_question",
          "detail": "Answer after supplier question from syn-ups-c.",
          "obligation_id": "handle_supplier_question:e5",
          "resolution_step": 8,
          "resolved": true,
          "status": "resolved",
          "supplier_id": "syn-ups-c",
          "trigger_event_id": "e5",
          "trigger_step": 7
        },
        {
          "actionable": true,
          "applicability_reason": "selected_award_uses_revision",
          "applicable": true,
          "category": "branch_conditional",
          "checkpoint": "request_quote_revision",
          "detail": "selected_events=['e6'], request_step=7, selected_path_repaired=True",
          "obligation_id": "request_quote_revision:syn-ups-c",
          "resolution_step": 7,
          "resolved": true,
          "status": "resolved",
          "supplier_id": "syn-ups-c",
          "trigger_event_id": null,
          "trigger_step": 5
        }
      ],
      "unresolved": 0,
      "version": "0.2.0"
    },
    "required_checkpoints": {
      "all_completed": true,
      "completed": 9,
      "results": [
        {
          "checkpoint": "solicit_competition",
          "complete": true,
          "detail": "RFQs sent to 3 suppliers",
          "evidence_mode": "direct"
        },
        {
          "checkpoint": "validate_eligibility",
          "complete": true,
          "detail": "Eligibility rule passed with evaluate_quotes",
          "evidence_mode": "proxy"
        },
        {
          "checkpoint": "recover_from_withdrawal",
          "complete": true,